{
  "$schema": "https://json-schema.org/draft/2020-12/schema",
  "$id": "urn:sieveruler:rules:v1",
  "title": "Transiever.SieveRuler rules document",
  "type": "object",
  "required": ["schemaVersion", "sourceId", "rules"],
  "properties": {
    "$schema": {
      "const": "urn:sieveruler:rules:v1"
    },
    "schemaVersion": {
      "const": 1
    },
    "sourceId": {
      "type": "string",
      "minLength": 1
    },
    "rules": {
      "type": "array",
      "items": {
        "$ref": "#/$defs/rule"
      }
    },
    "diagnostics": {
      "type": "array",
      "items": {
        "$ref": "#/$defs/diagnostic"
      }
    }
  },
  "additionalProperties": false,
  "$defs": {
    "rule": {
      "type": "object",
      "required": ["name", "targetFolder", "conditionMode", "conditions", "ownership", "requiredCapabilities"],
      "properties": {
        "id": {
          "type": ["string", "null"]
        },
        "name": {
          "type": "string"
        },
        "targetFolder": {
          "type": "string"
        },
        "actions": {
          "type": "array",
          "items": {
            "$ref": "#/$defs/action"
          }
        },
        "conditionMode": {
          "enum": ["All", "Any"]
        },
        "conditions": {
          "type": "array",
          "items": {
            "$ref": "#/$defs/condition"
          }
        },
        "exceptions": {
          "type": "array",
          "items": {
            "$ref": "#/$defs/condition"
          }
        },
        "sourceId": {
          "type": "string",
          "minLength": 1
        },
        "ownership": {
          "enum": ["Managed", "External"]
        },
        "originalOrder": {
          "type": ["integer", "null"],
          "minimum": 0
        },
        "requiredCapabilities": {
          "type": "array",
          "items": {
            "type": "string"
          },
          "uniqueItems": true
        }
      },
      "additionalProperties": false
    },
    "condition": {
      "type": "object",
      "required": ["type", "values"],
      "properties": {
        "type": {
          "enum": [
            "SenderContains",
            "ReceiverContains",
            "SubjectContains",
            "BodyContains",
            "SubjectOrBodyContains",
            "HasAttachment"
          ]
        },
        "values": {
          "type": "array",
          "items": {
            "type": "string"
          }
        }
      },
      "additionalProperties": false
    },
    "action": {
      "type": "object",
      "required": ["type", "values"],
      "properties": {
        "type": {
          "enum": [
            "FileInto",
            "CopyInto",
            "Redirect",
            "SetFlags",
            "Stop"
          ]
        },
        "values": {
          "type": "array",
          "items": {
            "type": "string"
          }
        },
        "value": {
          "type": ["string", "null"]
        }
      },
      "additionalProperties": false
    },
    "diagnostic": {
      "type": "object",
      "required": ["severity", "code", "message"],
      "properties": {
        "severity": {
          "type": "string"
        },
        "code": {
          "type": "string"
        },
        "message": {
          "type": "string"
        }
      },
      "additionalProperties": false
    }
  }
}
